[
  {
    "id": "geo_001",
    "subjectId": "raj_geography",
    "title": "राजस्थान की स्थिति एवं विस्तार",
    "description": "RAS Prelims Practice Test - Position and extent of Rajasthan. Covers geographical location, boundaries, and physical features.",
    "status": "LIVE",
    "questionsCount": 100,
    "duration": 120,
    "totalMarks": 100,
    "githubUrl": "https://raw.githubusercontent.com/Iamajeetram/ras-2026-questions/main/geography/geo_001.json",
    "createdAt": "2026-06-01T00:00:00Z",
    "updatedAt": "2026-06-01T00:00:00Z",
    "difficulty": "BEGINNER",
    "language": "en-hi"
  },
  {
    "id": "geo_002",
    "subjectId": "raj_geography",
    "title": "राजस्थान की जलवायु और मौसम",
    "description": "Climate and weather patterns of Rajasthan. Includes monsoons, temperature variations, and rainfall patterns.",
    "status": "LIVE",
    "questionsCount": 100,
    "duration": 120,
    "totalMarks": 100,
    "githubUrl": "https://raw.githubusercontent.com/Iamajeetram/ras-2026-questions/main/geography/geo_002.json",
    "createdAt": "2026-06-02T00:00:00Z",
    "updatedAt": "2026-06-02T00:00:00Z",
    "difficulty": "INTERMEDIATE",
    "language": "en-hi"
  },
  {
    "id": "hist_001",
    "subjectId": "raj_history",
    "title": "राजस्थान का प्राचीन इतिहास",
    "description": "Ancient history of Rajasthan including kingdoms, rulers, and major dynasties.",
    "status": "BETA",
    "questionsCount": 100,
    "duration": 120,
    "totalMarks": 100,
    "githubUrl": "https://raw.githubusercontent.com/Iamajeetram/ras-2026-questions/main/history/hist_001.json",
    "createdAt": "2026-06-02T10:30:00Z",
    "updatedAt": "2026-06-02T10:30:00Z",
    "difficulty": "ADVANCED",
    "language": "en-hi"
  },
  {
    "id": "hist_002",
    "subjectId": "raj_history",
    "title": "राजस्थान का मध्यकालीन इतिहास",
    "description": "Medieval history of Rajasthan covering sultanates, Mughal period, and local kingdoms.",
    "status": "LIVE",
    "questionsCount": 100,
    "duration": 120,
    "totalMarks": 100,
    "githubUrl": "https://raw.githubusercontent.com/Iamajeetram/ras-2026-questions/main/history/hist_002.json",
    "createdAt": "2026-05-28T00:00:00Z",
    "updatedAt": "2026-06-01T14:20:00Z",
    "difficulty": "INTERMEDIATE",
    "language": "en-hi"
  },
  {
    "id": "polity_001",
    "subjectId": "raj_polity",
    "title": "राजस्थान की राजनीतिक व्यवस्था",
    "description": "Political system of Rajasthan including government structure and administration.",
    "status": "LIVE",
    "questionsCount": 100,
    "duration": 120,
    "totalMarks": 100,
    "githubUrl": "https://raw.githubusercontent.com/Iamajeetram/ras-2026-questions/main/polity/polity_001.json",
    "createdAt": "2026-06-01T08:00:00Z",
    "updatedAt": "2026-06-03T09:15:00Z",
    "difficulty": "INTERMEDIATE",
    "language": "en-hi"
  },
  {
    "id": "ca_001",
    "subjectId": "current_affairs",
    "title": "करंट अफेयर्स - जून 2026",
    "description": "Current affairs and recent developments in June 2026.",
    "status": "BETA",
    "questionsCount": 50,
    "duration": 60,
    "totalMarks": 50,
    "githubUrl": "https://raw.githubusercontent.com/Iamajeetram/ras-2026-questions/main/current-affairs/ca_001.json",
    "createdAt": "2026-06-03T00:00:00Z",
    "updatedAt": "2026-06-03T00:00:00Z",
    "difficulty": "BEGINNER",
    "language": "en-hi"
  },
  {
    "id": "econ_001",
    "subjectId": "raj_economy",
    "title": "राजस्थान की अर्थव्यवस्था",
    "description": "Economy of Rajasthan including agriculture, industries, and trade.",
    "status": "ARCHIVED",
    "questionsCount": 100,
    "duration": 120,
    "totalMarks": 100,
    "githubUrl": "https://raw.githubusercontent.com/Iamajeetram/ras-2026-questions/main/economy/econ_001.json",
    "createdAt": "2026-05-01T00:00:00Z",
    "updatedAt": "2026-05-15T12:00:00Z",
    "difficulty": "INTERMEDIATE",
    "language": "en-hi"
  }
]
